{
  "run_id": "RUN-2026-03-23-001",
  "overall_status": "PASS",
  "checks": [
    {
      "check_id": "python_available",
      "status": "PASS",
      "message": "Python disponível.",
      "blocking": true
    },
    {
      "check_id": "api_key_present",
      "status": "PASS",
      "message": "API key encontrada em api.env.txt.",
      "blocking": true
    }
  ],
  "blocking_failures": [],
  "warnings": []
}
